{"$id":"https://dpslab.local/schemas/source-coverage-manifest-0.1.json","$schema":"https://json-schema.org/draft/2020-12/schema","additionalProperties":false,"properties":{"identity":{"additionalProperties":false,"properties":{"content_version":{"type":"string"},"created_at":{"type":"string"},"document_id":{"type":"string"}},"required":["document_id","content_version","created_at"],"type":"object"},"integrity":{"additionalProperties":false,"properties":{"hash_algorithm":{"const":"sha256"},"manifest_sha256":{"pattern":"^[0-9a-f]{64}$","type":"string"}},"required":["manifest_sha256","hash_algorithm"],"type":"object"},"requirements":{"items":{"additionalProperties":false,"properties":{"acquisition_classes":{"items":{"enum":["manual","first_party_api","signed_artifact","reviewed_document_snapshot"]},"minItems":1,"type":"array","uniqueItems":true},"family_id":{"type":"string"},"invalidation_triggers":{"items":{"type":"string"},"type":"array","uniqueItems":true},"license_classes":{"items":{"enum":["first_party_public","permitted_derived_use","synthetic_only"]},"minItems":1,"type":"array","uniqueItems":true},"max_age_seconds":{"minimum":1,"type":"integer"},"role_scope":{"enum":["all","damage","tank","healer"]},"source_id":{"type":"string"},"source_owner":{"type":"string"}},"required":["family_id","source_owner","source_id","acquisition_classes","license_classes","max_age_seconds","invalidation_triggers","role_scope"],"type":"object"},"minItems":1,"type":"array"},"schema_version":{"const":"0.1"},"subject":{"additionalProperties":false,"properties":{"build_max":{"minimum":1,"type":"integer"},"build_min":{"minimum":1,"type":"integer"},"class_id":{"minimum":1,"type":"integer"},"content_contexts":{"items":{"type":"string"},"minItems":1,"type":"array","uniqueItems":true},"interface_max":{"minimum":1,"type":"integer"},"interface_min":{"minimum":1,"type":"integer"},"role":{"enum":["damage","tank","healer"]},"specialization_id":{"minimum":1,"type":"integer"},"wow_product":{"const":"retail"}},"required":["wow_product","build_min","build_max","interface_min","interface_max","class_id","specialization_id","role","content_contexts"],"type":"object"}},"required":["schema_version","identity","subject","requirements","integrity"],"title":"DpsLab Source Coverage Manifest 0.1","type":"object"}
