{"identity":{"content_version":"0.1.0","created_at":"2026-07-31T00:00:00Z","document_id":"synthetic.coverage.manifest.001"},"integrity":{"hash_algorithm":"sha256","manifest_sha256":"217f37e39c9d7f2f377e377b52f80f0869ee9742163f289c5a7cd09c8150ee31"},"requirements":[{"acquisition_classes":["reviewed_document_snapshot"],"family_id":"synthetic.mechanics","invalidation_triggers":["new_build","source_withdrawn"],"license_classes":["synthetic_only"],"max_age_seconds":172800,"role_scope":"all","source_id":"synthetic.mechanics.source","source_owner":"dpslab.synthetic"},{"acquisition_classes":["reviewed_document_snapshot"],"family_id":"synthetic.role.damage","invalidation_triggers":["new_build","source_withdrawn"],"license_classes":["synthetic_only"],"max_age_seconds":172800,"role_scope":"damage","source_id":"synthetic.damage.source","source_owner":"dpslab.synthetic"}],"schema_version":"0.1","subject":{"build_max":120999,"build_min":120000,"class_id":1,"content_contexts":["synthetic_single_target"],"interface_max":120999,"interface_min":120000,"role":"damage","specialization_id":71,"wow_product":"retail"}}
